{
  "$schema": "https://json-schema.org/draft/2020-12/schema",
  "$id": "https://sourcefold.local/schemas/skill.schema.json",
  "title": "Навык",
  "description": "Навык из списка навыков книги правил. Персонажи ссылаются на навык по id и, если нужно, по специализации (Р-25).",
  "type": "object",
  "required": ["schema", "id", "kind", "name", "base", "category", "axes", "sources"],
  "additionalProperties": false,
  "properties": {
    "schema": { "const": "sourcefold.skill.v0" },
    "id": { "$ref": "common.schema.json#/$defs/id" },
    "kind": { "const": "skill" },
    "name": { "$ref": "common.schema.json#/$defs/text" },
    "aliases": {
      "type": "array",
      "items": { "type": "string" },
      "description": "Другие названия того же навыка в книгах и переводах («Средства» = «Кредитный рейтинг»)."
    },
    "base": { "$ref": "#/$defs/base" },
    "category": {
      "enum": ["бой", "восприятие", "движение", "знания", "медицина", "мифы", "расследование", "социальные", "техника", "языки"]
    },
    "uncommon": { "type": "boolean", "description": "Редкий навык (не входит в основной список листа персонажа)." },
    "specializations": {
      "type": "array",
      "description": "Специализации навыка-группы (Ближний бой, Стрельба, Наука, Иностранный язык…).",
      "items": {
        "type": "object",
        "required": ["name"],
        "additionalProperties": false,
        "properties": {
          "name": { "$ref": "common.schema.json#/$defs/text" },
          "base": { "$ref": "#/$defs/base" }
        }
      }
    },
    "axes": { "$ref": "common.schema.json#/$defs/axes" },
    "description": { "$ref": "common.schema.json#/$defs/text" },
    "examples": { "type": "array", "items": { "type": "string" } },
    "sources": { "type": "array", "minItems": 1, "items": { "$ref": "common.schema.json#/$defs/source_ref" } },
    "corrections": { "type": "array", "items": { "$ref": "common.schema.json#/$defs/correction" } },
    "quality": { "$ref": "common.schema.json#/$defs/quality" }
  },
  "$defs": {
    "base": {
      "description": "Базовое значение: число процентов или формула от характеристики (Уклонение — половина ЛВК, Родной язык — ОБР).",
      "type": "object",
      "required": ["raw"],
      "additionalProperties": false,
      "properties": {
        "raw": { "type": "string" },
        "value": { "type": ["integer", "null"] },
        "formula": { "enum": ["half_dex", "edu", "varies", null] }
      }
    }
  }
}
