{
  "schema": "sourcefold.skill.v0",
  "id": "coc:skill:chess",
  "kind": "skill",
  "name": {
    "ru": "Шахматы",
    "en": "Chess"
  },
  "base": {
    "raw": "—",
    "value": null,
    "formula": null
  },
  "category": "знания",
  "uncommon": true,
  "axes": {
    "era": [
      "any"
    ],
    "ruleset": "core"
  },
  "description": {
    "ru": "Игра в шахматы. В правилах 7-й редакции игрового навыка нет; в «Масках Ньярлатхотепа» шахматы даны отдельным навыком (Автар Сингх, Таан Каур).",
    "en": null
  },
  "sources": [
    {
      "book_id": "masks-of-nyarlathotep-en",
      "physical_page": 445,
      "printed_page": 442,
      "method": "book_text",
      "verified": true
    }
  ],
  "quality": {
    "needs_review": false,
    "flags": [
      "translated"
    ],
    "notes": "Описание выведено из названия и текста о персонаже: в книге навык не расшифрован."
  }
}
