{
  "schema": "sourcefold.skill.v0",
  "id": "coc:skill:firearms",
  "kind": "skill",
  "name": {
    "ru": "Стрельба",
    "en": "Firearms"
  },
  "base": {
    "raw": "разное",
    "value": null,
    "formula": "varies"
  },
  "category": "бой",
  "uncommon": false,
  "specializations": [
    {
      "name": {
        "ru": "Винтовка/дробовик",
        "en": "Rifle/Shotgun"
      },
      "base": {
        "raw": "25%",
        "value": 25,
        "formula": null
      }
    },
    {
      "name": {
        "ru": "Лук",
        "en": "Bow"
      },
      "base": {
        "raw": "15%",
        "value": 15,
        "formula": null
      }
    },
    {
      "name": {
        "ru": "Огнемёт",
        "en": "Flamethrower"
      },
      "base": {
        "raw": "10%",
        "value": 10,
        "formula": null
      }
    },
    {
      "name": {
        "ru": "Пистолет",
        "en": "Handgun"
      },
      "base": {
        "raw": "20%",
        "value": 20,
        "formula": null
      }
    },
    {
      "name": {
        "ru": "Пистолет-пулемёт",
        "en": "Submachine Gun"
      },
      "base": {
        "raw": "15%",
        "value": 15,
        "formula": null
      }
    },
    {
      "name": {
        "ru": "Пулемёт",
        "en": "Machine Gun"
      },
      "base": {
        "raw": "10%",
        "value": 10,
        "formula": null
      }
    },
    {
      "name": {
        "ru": "Тяжёлое вооружение",
        "en": "Heavy Weapons"
      },
      "base": {
        "raw": "10%",
        "value": 10,
        "formula": null
      }
    }
  ],
  "axes": {
    "era": [
      "any"
    ],
    "ruleset": "core"
  },
  "description": {
    "ru": "Группа специализаций огнестрельного и некоторых дистанционных видов оружия.",
    "en": null
  },
  "sources": [
    {
      "book_id": "keeper-rulebook-ru",
      "physical_page": 69,
      "printed_page": 73,
      "method": "book_text",
      "verified": true
    },
    {
      "book_id": "investigator-handbook-ru",
      "physical_page": 93,
      "printed_page": 97,
      "method": "book_text",
      "verified": true
    }
  ],
  "corrections": [
    {
      "field": "specializations[Винтовка/Дробовик].name.ru",
      "from": "Винтовка/Дробовик",
      "to": "Винтовка/дробовик",
      "reason": "значение по «Книге хранителя»",
      "ref": "«Книга хранителя», «Список навыков», с. 54 (физ. 51)"
    }
  ],
  "aliases": [
    "Винтовка",
    "Дробовик"
  ]
}
