{
  "schema": "sourcefold.skill.v0",
  "id": "coc:skill:gamble-recklessly",
  "kind": "skill",
  "name": {
    "ru": "Безрассудная азартная игра",
    "en": "Gamble Recklessly"
  },
  "base": {
    "raw": "—",
    "value": null,
    "formula": null
  },
  "category": "социальные",
  "uncommon": true,
  "axes": {
    "era": [
      "any"
    ],
    "ruleset": "core"
  },
  "description": {
    "ru": "Играть в азартные игры по-крупному и без оглядки на проигрыш. Нестандартный навык NPC «Масок Ньярлатхотепа» (Абдул Навиша).",
    "en": null
  },
  "sources": [
    {
      "book_id": "masks-of-nyarlathotep-en",
      "physical_page": 292,
      "printed_page": 289,
      "method": "book_text",
      "verified": true
    }
  ],
  "quality": {
    "needs_review": false,
    "flags": [
      "translated"
    ],
    "notes": "Описание выведено из названия и текста о персонаже: в книге навык не расшифрован."
  }
}
