{
  "schema": "sourcefold.skill.v0",
  "id": "coc:skill:foretell-the-future",
  "kind": "skill",
  "name": {
    "ru": "Предсказание будущего",
    "en": "Foretell the Future"
  },
  "base": {
    "raw": "—",
    "value": null,
    "formula": null
  },
  "category": "восприятие",
  "uncommon": true,
  "axes": {
    "era": [
      "any"
    ],
    "ruleset": "core"
  },
  "description": {
    "ru": "Провидеть грядущее. Навык колдуна Старого Бундари в «Масках Ньярлатхотепа»; ближайшая механика — психическая сила «Прорицание» (Divination) из Pulp Cthulhu.",
    "en": null
  },
  "sources": [
    {
      "book_id": "masks-of-nyarlathotep-en",
      "physical_page": 443,
      "printed_page": 440,
      "method": "book_text",
      "verified": true
    }
  ],
  "quality": {
    "needs_review": false,
    "flags": [
      "translated"
    ],
    "notes": "Описание выведено из названия и текста о персонаже: в книге навык не расшифрован."
  }
}
