{
  "schema": "sourcefold.skill.v0",
  "id": "coc:skill:throw",
  "kind": "skill",
  "name": {
    "ru": "Метание",
    "en": "Throw"
  },
  "base": {
    "raw": "20%",
    "value": 20,
    "formula": null
  },
  "category": "бой",
  "uncommon": false,
  "axes": {
    "era": [
      "any"
    ],
    "ruleset": "core"
  },
  "description": {
    "ru": "Бросок предметов и метательного оружия; дальность часто зависит от СИЛ.",
    "en": null
  },
  "sources": [
    {
      "book_id": "keeper-rulebook-ru",
      "physical_page": 60,
      "printed_page": 63,
      "method": "book_text",
      "verified": true
    }
  ]
}
