{
  "schema": "sourcefold.skill.v0",
  "id": "coc:skill:climb",
  "kind": "skill",
  "name": {
    "ru": "Лазание",
    "en": "Climb"
  },
  "base": {
    "raw": "20%",
    "value": 20,
    "formula": null
  },
  "category": "движение",
  "uncommon": false,
  "axes": {
    "era": [
      "any"
    ],
    "ruleset": "core"
  },
  "description": {
    "ru": "Подъём по стенам, скалам, канатам и другим сложным поверхностям.",
    "en": null
  },
  "sources": [
    {
      "book_id": "keeper-rulebook-ru",
      "physical_page": 58,
      "printed_page": 61,
      "method": "book_text",
      "verified": true
    }
  ]
}
