{
  "schema": "sourcefold.skill.v0",
  "id": "coc:skill:leer",
  "kind": "skill",
  "name": {
    "ru": "Плотоядный взгляд",
    "en": "Leer"
  },
  "base": {
    "raw": "—",
    "value": null,
    "formula": null
  },
  "category": "социальные",
  "uncommon": true,
  "axes": {
    "era": [
      "any"
    ],
    "ruleset": "core"
  },
  "description": {
    "ru": "Откровенно сальный, раздевающий взгляд, которым персонаж смущает и задевает собеседников. Шуточный навык NPC «Масок Ньярлатхотепа» (полковник Генри Эндикотт).",
    "en": null
  },
  "sources": [
    {
      "book_id": "masks-of-nyarlathotep-en",
      "physical_page": 423,
      "printed_page": 420,
      "method": "book_text",
      "verified": true
    }
  ],
  "quality": {
    "needs_review": false,
    "flags": [
      "translated"
    ],
    "notes": "Описание выведено из названия и текста о персонаже: в книге навык не расшифрован."
  }
}
