{
  "schema": "sourcefold.skill.v0",
  "id": "coc:skill:drink-like-a-sailor",
  "kind": "skill",
  "name": {
    "ru": "Пить как матрос",
    "en": "Drink Like a Sailor"
  },
  "base": {
    "raw": "—",
    "value": null,
    "formula": null
  },
  "category": "социальные",
  "uncommon": true,
  "axes": {
    "era": [
      "any"
    ],
    "ruleset": "core"
  },
  "description": {
    "ru": "Шуточный навык: много пить, не пьянея, и перепивать собутыльников. Есть у NPC «Масок Ньярлатхотепа» (Жюль Савояр).",
    "en": null
  },
  "sources": [
    {
      "book_id": "masks-of-nyarlathotep-en",
      "physical_page": 613,
      "printed_page": 610,
      "method": "book_text",
      "verified": true
    }
  ],
  "quality": {
    "needs_review": false,
    "flags": [
      "translated"
    ],
    "notes": "Описание выведено из названия и текста о персонаже: в книге навык не расшифрован."
  }
}
