{
  "schema": "sourcefold.skill.v0",
  "id": "coc:skill:sinister-stare",
  "kind": "skill",
  "name": {
    "ru": "Зловещий взгляд",
    "en": null
  },
  "aliases": [
    "Угрожающий взгляд"
  ],
  "base": {
    "raw": "—",
    "value": null,
    "formula": null
  },
  "category": "социальные",
  "uncommon": true,
  "axes": {
    "era": [
      "any"
    ],
    "ruleset": "core"
  },
  "description": {
    "ru": "Молча смотреть так, что собеседнику становится не по себе; невербальное запугивание. Навык Норвелла Хастингса, верного слуги Маршей; в варианте «Угрожающий взгляд» — у Хелен Дэвис и Мэри Миллер.",
    "en": null
  },
  "sources": [
    {
      "book_id": "pobeg-iz-innsmuta-ru",
      "physical_page": 33,
      "printed_page": 33,
      "method": "book_text",
      "verified": true,
      "note": "Норвелл Хастингс"
    },
    {
      "book_id": "pobeg-iz-innsmuta-ru",
      "physical_page": 43,
      "printed_page": 43,
      "method": "book_text",
      "verified": true,
      "note": "Хелен Дэвис, Мэри Миллер — «Угрожающий взгляд»"
    }
  ],
  "quality": {
    "needs_review": false,
    "flags": [],
    "notes": "Описание выведено из названия и текста о персонаже: в книге навык не расшифрован. «Угрожающий взгляд» сведён к этой записи как другой перевод того же навыка (вывод). Английское название не известно (русское издание)."
  }
}
