{
  "schema": "sourcefold.skill.v0",
  "id": "coc:skill:dodge",
  "kind": "skill",
  "name": { "ru": "Уклонение", "en": "Dodge" },
  "base": { "raw": "половина ЛВК", "value": null, "formula": "half_dex" },
  "category": "бой",
  "axes": { "era": ["any"], "ruleset": "core" },
  "description": { "ru": "Позволяет уйти от удара или броска в ближнем бою.", "en": null },
  "sources": [{ "book_id": "keeper-rulebook-ru", "physical_page": null, "printed_page": null, "method": "helper_migration", "verified": false }]
}
